<?xml version="1.0" encoding="UTF-8"?>
<bean xmlns:xsi="http://www.w3.org/2001/XMLSchema-instance" 
      xsi:noNamespaceSchemaLocation="../xml_bean.xsd">
	<path jsp="E:/project/mrbt/mrbt_oa/WebContent/WEB-INF/jsp/company/depart" 
	js="E:/project/mrbt/mrbt_oa/WebContent/resource/js/company/depart"
	vist-url="/rest/company/depart" />
	<title>权限管理</title>
	<comboMaps>
		<entry>
			<string>dp_status</string>
			<list>
				<TypeCombo option="0" text="有效"/>
				<TypeCombo option="1" text="无效"/>
			</list>
		</entry>
	</comboMaps>
	<columns>
		<column name="id" label="id" id="true"/>
		<column  name="dpName" type="string" search="true" label="部门名称"></column>
		<column  name="dpStatus" format="combobox" type="combobox" label="部门状态" comboName="dp_status" ></column>
	</columns>
</bean>